{
  "ada:basemap": "basemap_BSE_001.tif",
  "ada:originX": 0.0,
  "ada:originY": 0.0,
  "ada:originZ": 0.0,
  "ada:coordDef": "pixel-defined",
  "ada:coordUnits": "micrometer",
  "ada:pixelUnits": "micrometer",
  "ada:pixelScaleX": 0.125,
  "ada:pixelScaleY": 0.125,
  "ada:originLocation": "upperLeft"
}